{
  "id": "e2f3a4b5-c6d7-4890-1234-567890abcdef",
  "applicant_id": "b2c3d4e5-f6a7-4890-bcde-f01234567890",
  "organization_id": "f1e2d3c4-b5a6-4978-9012-345678901234",
  "holder_user_id": "a1b2c3d4-e5f6-4789-abcd-ef0123456789",
  "status": "ACTIVE",
  "ttl_seconds": 1800,
  "expires_at": "2026-03-15T15:00:00Z",
  "created_at": "2026-03-15T14:30:00Z"
}
